{
  "$schema": "./lutcalc-theme.schema.json",
  "id": "kde",
  "name": "KDE",
  "description": "KDE Plasma 风格：Breeze 蓝、冷灰面板与清晰的控件层次。",
  "fontFamily": "Noto Sans, 'Noto Sans SC', sans-serif",
  "radius": "6px",
  "modes": {
    "light": { "label": "亮色", "colors": { "canvas": "#eff0f1", "surface": "#fcfcfc", "surfaceMuted": "#e8eaed", "sidebar": "#f4f5f6", "card": "#ffffff", "text": "#232629", "muted": "#5f6368", "border": "#c7cbd1", "accent": "#3daee9", "accentHover": "#1d99d3", "accentSoft": "#e0f2ff", "topbar": "#31363b", "topbarText": "#eff0f1", "control": "#f6f7f8", "controlHover": "#e4e7eb", "input": "#ffffff", "inputDisabled": "#ebedf0", "focus": "rgba(61,174,233,.35)", "success": "#27ae60", "danger": "#da4453", "shadow": "0 2px 5px rgba(35,38,41,.12)", "link": "#1d78b3", "previewBlend": "multiply" } },
    "dark": { "label": "深色", "colors": { "canvas": "#232629", "surface": "#2b3035", "surfaceMuted": "#31363b", "sidebar": "#2a2e32", "card": "#31363b", "text": "#eff0f1", "muted": "#b0b8bf", "border": "#4b5258", "accent": "#3daee9", "accentHover": "#6bc5f2", "accentSoft": "#193b50", "topbar": "#1b1e20", "topbarText": "#eff0f1", "control": "#3b4147", "controlHover": "#4b5258", "input": "#262b2f", "inputDisabled": "#343a40", "focus": "rgba(61,174,233,.42)", "success": "#2ecc71", "danger": "#ed5865", "shadow": "0 4px 16px rgba(0,0,0,.30)", "link": "#7dcfff", "previewBlend": "normal" } }
  }
}
