{
  "$schema": "./lutcalc-theme.schema.json",
  "id": "ubuntu",
  "name": "Ubuntu",
  "description": "Ubuntu 桌面风格：茄紫系统栏、暖灰桌面与 Ubuntu 橙强调。",
  "fontFamily": "Ubuntu, 'Noto Sans SC', sans-serif",
  "radius": "4px",
  "modes": {
    "light": { "label": "亮色", "colors": { "canvas": "#deddda", "surface": "#f7f7f7", "surfaceMuted": "#f0efec", "sidebar": "#f7f7f7", "card": "#ffffff", "text": "#242424", "muted": "#6b6b6b", "border": "#d6d6d6", "accent": "#e95420", "accentHover": "#d94818", "accentSoft": "#fff3ed", "topbar": "#2c001e", "topbarText": "#ffffff", "control": "#ededed", "controlHover": "#e2e2e2", "input": "#ffffff", "inputDisabled": "#efefef", "focus": "rgba(233,84,32,.34)", "success": "#299c5c", "danger": "#a51d2d", "shadow": "0 1px 2px rgba(0,0,0,.10)", "link": "#b5481e", "previewBlend": "multiply" } },
    "dark": { "label": "深色", "colors": { "canvas": "#1f1f22", "surface": "#28282d", "surfaceMuted": "#333338", "sidebar": "#242429", "card": "#303036", "text": "#f5f5f5", "muted": "#bababa", "border": "#4b4b52", "accent": "#ff784b", "accentHover": "#ff966f", "accentSoft": "#49291e", "topbar": "#170011", "topbarText": "#ffffff", "control": "#3a3a41", "controlHover": "#484850", "input": "#242429", "inputDisabled": "#313138", "focus": "rgba(255,120,75,.40)", "success": "#5ddc8c", "danger": "#ff7373", "shadow": "0 3px 14px rgba(0,0,0,.30)", "link": "#ffb49c", "previewBlend": "normal" } }
  }
}
